id_cat;text
0;"Вкусные позы классические и рыбные (что меня удивило, первый раз такие ела и понравились). И, конечно же, медовик - пальчики оближешь, а ещё таежный десерт со сгущенкой ??Имейте в виду, если будете планировать ужин в этом месте - бронируете столик заранее. Вечером здесь полно народу, что не плохо (с одной стороны;)).Мы брали здесь еду с собой и ужинали в своем номере в Маленьком Шале, где самый сказочный вид на этом острове ????Всем приятного аппетита ??????"
0;Отличный ресторан! Готовят вкусно и не долго, подойдет для взрослых и детей. Заведение не большое, но очень уютное. Персонал приветливый. Нам с семьей очень понравилось, определенно рекомендую для посещения!
0;Очень вкусный чай! Домашний тортик! Но всем просто рекомендую обязательно попробовать бузы с омулем!!! Очень приятный дружелюбный персонал, который сделает ваше времяпрепровождение более комфортным и уютным.
1;В кафе вкусная и разнообразная еда. Представлены как блюда национальной бурятской кухни ( бухлер, буузы, хуширы, цуйван, домбар) так и обычные наггетсы картофель фри, солянка, уха и т д. Вкусные чаи, безалкогольный глинтвейн. Есть пиво. Народу всегда очень много. Но обслуживают быстро. Оплата сразу при заказе на кассе, в чеке номер, который официант выкрикивает, вынося заказ в зал. Цены средние. Из минусов - ушатанная разномастная мебель, как будто с разных помоек собранная, разнокалиберная посуда, сервировка тоже - больше название. Таким образом, это не ресторан, а кафе - бистро с вкусной едой быстрым обслуживанием
1;Помещение желает реставрации, а интерьер обновления. Стиль кафе столовка. Только кухня радовала, вкусно и разнообразно. Есть местная кухня для тех, кто не пробовал Буузы, Бухл?р, Хушур.. По чистоте 3,туалет грязный, нечем руки вытирать, сушилка еле работает. 
1;"Вкусно и уютно. Еда на ресторанном уровне. Бузы самые лучшие) пельмени настоящие. И выпечка …прям как в городе ?? сюда придти и поесть и взрослым и детям и выпить кофе. Готовят в прямом режиме, так что закладывать время на приготовление ; Бузы 15/20 мин. И это шикарно! ( на фото, только выпечка, свое мясное я уже съела) Спасибо большое ."
1;В кафе вкусная и разнообразная еда. Представлены как блюда национальной бурятской кухни ( бухлер, буузы, хуширы, цуйван, домбар) так и обычные наггетсы картофель фри, солянка, уха и т д. Вкусные чаи, безалкогольный глинтвейн. Есть пиво. Народу всегда очень много. Но обслуживают быстро. Оплата сразу при заказе на кассе, в чеке номер, который официант выкрикивает, вынося заказ в зал. Цены средние. Из минусов - ушатанная разномастная мебель, как будто с разных помоек собранная, разнокалиберная посуда, сервировка тоже - больше название. Таким образом, это не ресторан, а кафе - бистро с вкусной едой быстрым обслуживанием
1;Помещение желает реставрации, а интерьер обновления. Стиль кафе столовка. Только кухня радовала, вкусно и разнообразно. Есть местная кухня для тех, кто не пробовал Буузы, Бухл?р, Хушур.. По чистоте 3,туалет грязный, нечем руки вытирать, сушилка еле работает. 
1;"Вкусно и уютно. Еда на ресторанном уровне. Бузы самые лучшие) пельмени настоящие. И выпечка …прям как в городе ?? сюда придти и поесть и взрослым и детям и выпить кофе. Готовят в прямом режиме, так что закладывать время на приготовление ; Бузы 15/20 мин. И это шикарно! ( на фото, только выпечка, свое мясное я уже съела) Спасибо большое ."
1;Великолепная домашняя кухня!Бюджетно, большие порции и все очень вкусно.Чебуреки огромные, начинки много.брали много блюд, были там несколько раз и всегда все вкусно.
1;Главный плюс места - можно попробовать сесть без брони. Людей много, но это возможно.Обслуживание средней скорости. Официанты особо по блюдам не подскажут, заказывать все нужно на кассе.Буузы нормальные, но не самые вкусные. Много мест на острове, где они вкуснее бывают. Буузы бывают на грани, что могут порваться.По дороге на Шаманку или обратно зайти можно, могут работать даже когда электричество отключилось, но тем не менее заходил только 1 раз за все пребывание на Ольхоне
1;Вкусными в этом кафе  можно назвать чебуреки (большой, сочный, с настоящим мясным фаршем) и свежие пирожки (вкусное воздушное тесто,много начинки,есть пирожки с черемшой). Уха, так называемая, это суп с рисом, в кот. будто случайно оказался кусок рыбы, при чем в меню это не указано, а хотелось настоящего прозрачного наваристого рыбного бульона....Остальные блюда посредственны,хотя съедобны. Вопросы вызывыет чистота столов,приборов, работа официантов,которые много путаются, забывают принести приборы,игнорируют просьбы. И стая огромных псов,которые практически мордой залязят в тарелки посетителей на веранде.В общем, ожидания не совсем совпали с реальностью...
1;Большой ассортимент, много посадочных мест, и летняя веранда - это вс? кафе Далай. У них очень приемлемые цены, но столы и стулья как в советских столовых, в этом есть свой уют. Милое заведение! 
1;Лучшее кафе в округе, где была) Вкуснейшие чебуреки, классный цезарь, щедрый чаек с облепихой. Жареная рыбка огонь))Пустили со своей маленькой собачкой, спасибо) Мне очень понравилосьСразу за нами пришла толпа и все места заняли Поставьте еще столы. У вас аншлаг, ребята)Посоветовал гид. Еще сюда пришли иностранцы)А вообще просто и по домашнему. Зашла сюда случайно, тк этническое кафе рядом было закрыто. Сделайте вывеску поярче))
1;Все очень понравилось. Порции полновесные . быстрое обслуживание. Вкусно готовят и цены доступные. Только на кассе молодой человек, не очень приветливый  слегка грубоват . создается впечатление, что вынужденно работает и посетителям не рад. Вот девушка официантка , супер ! Все у нее спорится и приветливая . Отдельное спасибо этой девушке . Место хорошее рекомендую.
1;Отличное место в селе Хужир!Завтракали, обедали и ужинали тут. Вкусная и качественная еда. Очень приятный персонал, который заботится о посетителях.Спасибо!
1;Кормим здесь своих туристов уже не первый год! Все очень вкусно ?? В пиковое время мест сложно найти, официанты частенько тупят….Интерьер как в столовке) на это  все можно закрыть глаза, качество кухни очень высокое!
1;Очень приветливые и вежливые работники. Очень вкусно и цена соответствует месту. Приятно было туда ходить на обеды и ужины. Чебуреки отменные! 
1;Обслуживание неплохое, но вот на вкус… Борщ выглядит, как борщ, а на вкус далёк. Больше всего впечатлил салат свеклы с чесноком, который я всегда думала, что невозможно испортить, оказывается я недооценивала современную кулинарию. Майонез даже не размешался однородно, так и остался кусками как я ни старалась, не знаю уж из чего он у них сделан, а из чего тогда сделаны остальные продукты… Утолить голод можно, но ожидать вкуснейшую еду не стоит 
1;Вкусная еда и очень быстрая отдача, даже если много народа. Недавно провели ремонт в санузлах, теперь стало приятно приводить ещё и гостей. Варят кофе, можно заказать с собой. Два зала, по сочетание цена/качество самое оптимальное место
1;Ели с мужем чебуреки в данном кафе. Делают иилепят сами. Очень вкусно и по-домашнему! Наблюдала за посетителями. Всем нравится... Рекомендую!
1;Очень вкусно, чисто, все блюда очень классные! Национальные! Обслуживание хорошее только приходится долго ждать готовности блюд! Честно скажу и все ждут т. к. очень вкусно! Желаю вам расширения ребята! Вы классные! Спасибо за ваши способности! Шеф-повара вы крутые реально!
1;Самые вкусные позы там!??Даже не успели их сфотографировать, сразу съели)) Салаты свежие. Огромные воздушные чебуреки. Кухня супер. Цены очень демократичные. Супер приветливый персонал. Достаточно самобытное приятное место. Находясь в Хужире, точно стоит посетить!
1;Чебуреки отличные, друзья хвалили лично я не ем жареную выпечку, изжога. Солянка вкусная, Цезарь с курицей или сёмгой, отлично. Безалкогольный глинтвейн восхитителен, жаль безалкогольный. Позы на уровне, вкуснее только на экскурсии на катере на источнике, но там полная антисанитория. Что касается санитарных норм в Далай, тоже все под вопросом. Приборы с чистичками еды, приходится самостоятельно чистить салфетками, за это снял 2 звезды. Персонал вежливый, парень на кассе вечно уставший. Цены не демократичны, средний чек на одного, 900р
1;Ужасное место! Особенно  для тех кто следит за питанием.  Для тех кто на диете- вам не сюда!  Персонал приветствует не охотно, состав блюд не хотят менять.  В меню всё жареное.  На пару  только  позы  и те идут  с домашним  фаршем ( свинина-говядина), а я свинину не ем. Запеченого  ничего нет.    Папа заказал салат  цезарь   попросил убрать  соус цезарь ( он же майонезный) мы майонез не кушаем, попросили  заменить  на сметану, так нам вообще  отказывались  делать такое блюдо.   У папы строгая диета   после удаления  почки.  Нельзя  ничего  сладкого, жареного, солёного, маринованного, мучное  можно только  ржаную муку, а хлеба тут  чёрного  нет! Только  после  объяснения персоналу что у нас вот такая диета  нам приготовили  этот несчастный  салат. Муж заказал  картошку на сковороде  в сливочном соусе с луком, грибами и курицей (точное название не помню)- пересолили  ужас!!! Он не стал есть. Мама брала пиво и сырные палочки фри- тут претензий  нет.   Для тех кто на ПП- не место. Для тех кто любит жирок- welcome! Оценка 2+ с натяжкой  3
1;Очень не плохое и недорогое кафе. Большой выбор блюд. Понравился салат с помидорами и сыром,  овощи с сыром, суп чечевичный, десерты, Чебурек с сыром был большой, но пустой, начинки мало.Порции не очень большие, но можно заказать и по 2 порции)) Готовят не быстро 20-50 минут была подача, хоть и оправдано из-за большого количества посетителей.Есть места в Хужире вкуснее, но дороже.
1;"Отдыхали в Хужире в начале июля. Попробовали еду в нескольких кафе, отдали предпочтение ""Далаю"" (надеюсь, склоняется). Быстро, вкусно, демократичные цены. Помимо перечисленных в хвалебных отзывах блюд (чаще заказывала позы - очень вкусно) хочу отметить пирожки) Вкусное тесто, много начинки, нужно попасть на только что испеченные! Нам везло) Спасибо персоналу и поварам! "
1;Очень вкусная еда, бюджетно. Приходится ждать пока освободится столикФото меню для ознакомления Очень советую рыбу с картошкой и соусом Тар-Тар И цезарь с курицей И очень вкусный горячий шоколад ( для сладкоежек)
1;Наше любимое кафе в Хужире. Всё очень вкусно, отобенно нам понравился сагудай, чебуреки с пылу с жару, и прекрасный салат Цезарь. Вроде бы, ничего особенного, но порция большая, и вкус отменный. Каждый вечер тут ужинали и всегда были довольны.
1;Приятное место. Был в середине мая. Не сезон и холодно относительно. Были одни в ресторане. Выбор шикарный. Всё приготовили очень быстро. Хушуур особенно понравился (пирожок такой с мясом вообще топ). Очень вкусная запеченная картошка с мясом. Чай та?жный тоже супер. Однозначно рекомендую! 
1;Очень вкусно, большие порции, чебуреки просто огромные, рекомендую салат шаман, буузы пальчики оближешь!!! Обстановка чисто и лаконично, персонал хорошо.
1;Великолепная домашняя кухня, много национальных блюд! Были с супругой в начале октября и это было одно из немногих работающих кафе. Первый раз в жизни пробовал буузы и сугудай здесь 
1;Отличное кафе. Быстро готовят. Салат Шаман балдежный. Картофель фри лучше любого из фаст фудов, что реально удивило. Чай немножко слабоватый. Пельмени дали прям в бульоне, это меня не порадовало (сами пельмени норм). В целом, то что нужно. Цены приемлемые. В среднем, 800 рублей, чтобы хорошо поесть.
1;Цены здесь приемлемые , даже можно сказать ниже среднего. Меню очень даже большое и позволяет выбрать что-либо на свой вкус. Всегда есть свободные столы . Ждать свой заказ тут прийдётся не долго , т.к. из очень оперативно разносят официанты. Рекомендую!
1;Прекрасное кафе! Очень вкусная еда и совершенно замечательный персонал, который совершенно искренне помогут вам, если необходима какая- то помощь! Огромное спасибо! Очень рекомендуем!
1;"Самое лучшее кафе на Ольхоне! приятный персонал, уютная наружняя веранда, вкусные блюда и большой выбор. Очень понравился торт ""Три шоколада"". А еще доступные цены."
1;Из всех кафе на острове здесь самая съедобная еда. Быстрая подача. Вкусно! Вежливое обслуживание. 
1;Три звезды с натяжкой. На вид приличное, но бестолковое, не очень чистое кафе. Персонал много суетится и постоянно все путает. Были с детьми, заказали десерты. Дети не доели тортики, это прямо показатель.Со взрослой едой тоже не очень. Заказывали 2 порции беф-строганова, в одной тарелке все хорошо, в другой вместо мяса жилы. Солянка невкусная.К салату из помидор и чаю претензий нет. 
1;Очень быстро обслуживают, еда вкусная, цены демократичные. Национальные бурятские блюда, чебуреки. Посоветовала хозяйка гостевого дома, как одно из лучших мест Худжира. Интерьер простенький.
1;Удобно расположен, заказ приготовили быстро не смотря не то что был полный зал в 18-20, перед нами была тур группа 12чел , они сделали заказ и ушли на Шаманку. Наш заказ приняли с нашими пожеланиями блюд без лука, драники и салат приготовили быстро, мясо и гарнир с сыром ждал минут 20.У нас прошло все гладко и без претензий. Выбор есть, цены адекватные, выход блюд в граммах - нормальный 
1;Волшебно вкусно! Честно, 10 из 5, давно такого уровня кухни не видел. Вернусь, не раз, за таким можно и специально приехать!
1;Богатое меню, вкусная еда и напиткиГотовят достаточно быстроИз минусов : достаточно многолюдно
1;Очень вкусная домашняя еда. Однозначно лучшие буузы на Ольхоне. Очень вкусный цуйван. Рекомендую.
1;Вкусно, цены приемлемые, носят блюда быстро. Вкусные буузы, мне там понравились больше чем везде). Есть десерты, правда мы не пробовали, но выглядят красиво.
1;Очень вкусно. Чебурек большой я брала с сыром, также понравился салат с корейской морковкой. Также люди хвалят там позы. И еще бонус для тех кто живет в палатке, в зале есть свободные розетки для подзарядки гаджетов. Рекомендую одним словом !!!
1;Был здесь около года с небольшим назад,кухня была простая,но вкусная,официанты внимательные и вежливые,сегодня с друзьями приехали рассчитывая вкусно покушать- облом! Обслуживающая нас кросотка с грязными ногтями и сбивчивой речью перепутала заказ и мы ещё ждали плюсом 40 минут! Пища не выдерживает критики- невкусно было всё,кроме морса!!! Не рекомендую однозначно,ощущение что всё готовят на коленке,из самых дешевых продуктов,понимаю это по овощному салату- помидоры с огурцами плавали в собственном соку  и весь это ужас ещё и имел душок рыбы!Остались злые и голодные,и уж совершенно точно предостерегем друзей и знакомых что в этом кафе плохая еда !
