id_cat;text
6;Не оправдал ожмданий:(Пришли по рекомендации,но были сильно разочарованыНо по порядку:Из плюсов: расположение,приятный интерьер,камин и это все его плюсыМинусы:-еда не очень вкусная(заказывали салаты,уху,картошку,драники(дранмки были вкусные)-очень долгое обслуживание,ждали салатов почти 50 мин,но это ладно,но когда мы прождали 1,5 часа,двоим из 6 человек не принесли заказанную еду,про одного забыли,про второго,оказалось блюдо на стопе,но официант об этом не знал и даже потом не предложили принести что-то быстрое,чтоб поесть...извинений не последовало-размер порций небольшой-ценник высокий,по сравнению с Иркутском прям даже очень-в туалетах очень грязноНе соответствует цене и виду,не рекомендую от слова совсем
6;Попали случайно в ресторан, когда гуляли поздно вечером. Не пожалели. Какие великолепные бутерброды с бужениной! Наисвежайшие и наивкуснейшие. Посидели под негромкую музыку, пообщались. Очень быстро готовят, что тоже несомненный плюс, особенно вечером
6;Очень уютная атмосфера, вежливый и приятный персонал, чистота в номере, вкусный и разнообразный завтрак и все это в самом сердце Байкала, на берегу острова Ольхон)
6;Хороший ресторан, не ожидали такой в Хужире найти, приятно удивлены. Цены, конечно, высокие, практически столичный уровень, но обслуживание вполне приличное, кухня тоже хороша. Тем более, что аналогичных вариантов там и не найти.
6;Тёплый уютный отель, номера уютные, хорошо мебелированы.Отличное меню, всё очень вкусно, особенно чизкейки.Из минусов, завтрак в 9:00, это поздно. Было бы удобно с 8:00.
6;По отзывам этот отель-самый лучший на ольхоне. Плюсы: чисто, уютный номер. Минусы: номер брали трёхместный, разместились там 2взр и 2 детей, но номер крохотный, не развернуться. Батарей нет, только обогреватели. Были в феврале в - 25. В номерах холодно, но попросили доп обогреватель и стало норм. Ресторан при отеле-для Ольхона безумно дорогой, цены как в хорошем ресторане в москве, но цена-качество сервиса не равнозначна. Официантов, барменов надо, конечно, ещё учить.. Еда не плохая, но, смотря, что брать. Не все вкусно, а цены зашкаливают 
6;"Посещали ресторан дважды в период 22-30.07.23, что можно сказать:Плюсы: красивое оформление, удобное расположение, особенно приятно зайти после водных экскурсий, живой каминМинусы: - достаточно скудное для ресторана меню;- слишком переоцененные блюда. Тут самая высокая стоимость из всех трех мест аналогичного класса;- стоит уделить серьезное внимание работе с персоналом, вежливость, реакция, скорость обслуживания.Подитоживая, лично в нашем случае, очень долгое обслуживание (тут все, от приноса меню и до самого расчета), полное отсутствие реакции официанта(ки) на слово «Спасибо» (по привычке всегда говорим после подачи блюда, забора чего-либо и т.д.), умудрились положить утром обжаренный картофель в вечерний салат (обратили внимание оффицианта, ноль реакции), простые пельмени ребенку несли 45 минут, мы по два блюда успели съесть, разумеется извинений не последовало, а вы думали. А так, в принципе, красиво, не очень вкусно и слишком переоценено… Не порекомендую к посещению из соотношения цена/качество. Пока так…"
6;Вид из окон ?? но только с 2х столов ??Цены в принципе норм (примерно уровень Москвы), но сервис это просто жесть… зашли в 11.30 в рестике 3 человека, сели за стол, официанты внимания 0, ходят протирают столы ?????? ждали ждали пошли на стойку, говорим что есть, ответили, что кухня закрыта, но мы зашли выпить кофе с вкусняшками так, что с кухни нам ничего особо и не надо было. Отошел спросить, кто что будет тк меню нам не дали. Пока ходил (2минуты) девочка из бара куда-то скрылась. Вернулся к бару ждал ждал, в итоге выдернули официантку из зала которая все еще терла столы и старалась нас не замечать. Что в есть не знает, на любой вопрос, что есть из десертов точного ответа не получили, направили ее на кухню узнать у поваров, что есть в наличии.Итог заказать 2 кофе, чай и 3 десерта это 20 минут и то только потому, что бегал и просил их сам хоть что-то сделать. Еще накидывайте 15 мин пока все вынесли… Я не знаю кто ставит хорошие оценки, нооооо с таким сервисом в пустом в пустом зале, уверен что при полной посадке еды вообще не дождешься!!!Пс штрудель отличный, кофе вкусный?? за это + я звезда
6;Уютный ресторанчик. Нам не довелось посидеть в нем вечером, но мы забегали днем. Заказали кофе. Уютно, вкусно, девочки официанты обслуживают быстро и с улыбкой! Рекомендую
6;Лучший ресторан Ольхона. Всё очень вкусно и быстро. Ценник средний московский-петербургский. Очень атмосферное и уютное место - замечательный интерьер.
6;В Хужире не много заведений, и все они довольно простые по меню, интерьеру, сервису (я это называю «ненавязчивый сервис», хоть есть и довольно вкусные). Но этот ресторан выделяется, и если хочется эстетики ресторана, то вам однозначно сюда. Общее впечатление - отличный ресторан, хорошее обслуживание, приятная негромкая музыка создает отличный фон. Еда: все, что мы заказывали по меню, было вкусно. Цены: это самое дорогое заведение в Хужире (уровень московского не дешевого ресторана).  Но даже если вы привыкли есть дешевле, то зайдите сюда хотя бы раз, чтобы просто насладиться видом из окна за столиком с чашкой кофе и каким-то одним блюдом.
6;Пробовали там все блюда из местной рыбы. Если не придираться, то было вкусно.Что испортило впечатление.1. На ужине нас обсчитали на 1000 рублей и, даже, не извинились.2. В обед мы заказали борщ и уху. Блюда по 600 руб. Никаких дополнительных вкусняшек, в виде сала, лука, солений - не было. Давайте вспомним, как подают эти блюда в нормальных заведениях... Мы же не в столовую пришли... Попросили чёрный хлеб. Тоже не было. Больше прийти в это заведение, желание не возникло. 
6;Красивый , заглянули с прогулки . Думали выпить кофе , съесть десерт. Было свободно несколько столов 21:15 где-то . Со входа, максимально неприятное впечатление от персонала , кислые недовольные лица, общение сквозь губы , будто мы им плохое что-то сказали или сделали .Мы Спросили ,можно ли присесть, девушка задумалась, потом спросила , живем ли мы в их отеле .Мы сказали что нет , нам сказали мест нет с таким же небрежным тоном , как и встретили . Не хотел бы жить и есть в таком месте , где придется встречаться с таким персоналом. Вышли с осадком , который за два дня не прошел, решил отзыв отставить. 
6;Замечательное место, отличнейшие номера! В ресторане превосходная еда, дружелюбный и приветливый персонал! Имеется баня с выходом к Байкалу! Просто замечательное место для отдыха как с компанией так и с семьёй!
6;По моему мнению, одно из лучших мест на острове на сегодняшний день. Идеальное расположение, прекрасно оформленная территория и все необходимое в одном месте. Можнт просто приехать на остров, поселиться в этом отеле и вообще не покидать территорию, потому что можно получить максимальное удовольствие и все впечатления в одном месте. Ресторан заслуживает отдельного внимания, прекрасная работа повора, правильно подобранные блюда в меню.
6;Здравствуйте, у меня вопрос к владельцу этого «ресторана»Вы в курсе, что у вас происходит??? Отвратительный сервис, клиентоориентированность ноль. Наша компания в количестве 10 человек пришли пообедать в вашем ресторане. То, что не встречают при посадке 1 стол, можно пережить) Далее подходит официант (не представившись) говорит что всех позиций по рыбе нет. Окей. Делаем заказ из позиций в наличии!!! без стоп листа. Ждем порядка 20 минут, подходит официант, сообщает, что части позиций нет, и далее дословно- «мы не будем вас обслуживать , так как кухня закрывается делать заготовки»Уважаемый владелец и управляющий данной точки, я не знаю насколько для вас важна репутация и прибыль. Но приглашаю вас в город Санкт-Петербург на стажировку управление ресторанным бизнесом.Заодно рекомендую вам ознакомиться с порядком работы в соответствии с законами РФ, и искренне предлагаю не нарушать КоАП РФ и законы о зашите прав потребителей. Так же провести обучение и работу с персоналом, дабы не возникало таких позорящих лично Вас ситуаций. У вас прекрасная локация, интерьер, но то, что происходит с обслуживанием- крайне недопустимо.
6;Ужинал в первой половине марта 2023. Зал был почти полный, однако место нашлось и обслуживание было достойным: все принесли умеренно быстро, с улыбкой. Поприветствовали, меню предложили сразу.Интерьер - на уровне: потолки высокие, мебель удобная, огромный камин добавляет уюта. Был наслышан, что здесь дорого и не очень вкусно. Однако, Цезарь был достойным, рыбу в нем искать не приходилось, всё по канонам. Карбонара тоже по всем правилам и тоже вкусная. К сухому красному в бокале претензий нет. По цене - да, сложно не согласиться с критикой: за перечисленное отдал 2,3 тр и при желании за эту сумму в соседних позных (отстояв очередь и приютившись в тесном зале) можно поужинать 4 раза. Но это все-таки ресторан, не стоит ждать низких цен.
6;В целом нам понравилось. Снимаю одну звезду за цены и маленькое меню. Красивый интерьер, удобная посадка. Все, что брали, было безусловно вкусно: уха, позы, драники с семгой, омуль с пюре, салат с байкальской рыбой. Прекрасная Маргарита, домашние лимонады. С обслуживанием не было проблем, хотя люди рядом жаловались и просили администратора с претензией, что все очень долго
6;Всё очень плохо!! Заказав блюдо с белыми грибами, повар почему-то решил, что за эту цену подойдут и шампиньоны... Рыбный суп от любви к нам - пересолил... Чай давно такой невкусный не пил... Короче говоря, официант только бегал и извинялся, а повар всё продолжал и продолжал делать эксклюзив.... Не хотелось в отпуске ругаться, дабы не портить себе настроение... Плохо очень товарищи.... Контроля нет..
6;Красивое место, очень атмосферное, еда могла быть и вкуснее, но и пробовали мы только суп, борщ свой вкуснее получается??но повторюсь, очень красиво, а так в следующую поездку закажем другие блюда??
6;Отель является одним из лучших на Ольхоне, и это правда, чисто, уютно, минималистично, всё необходимое имеется:) Ресторан просто шикарный, очень вкусно, атмосферно. Очень приятный и отзывчивый персонал?
6;Мой любимый ресторан на Ольхоне, атмосферное место, с камином, вкусным кофе и десертами. Вокруг территория так же облагорожена, различные интересные арт-объекты, рекомендую к посещению
6;Вид антуражный : за стойкой бара фрезеровальный и токарный станок, в зале фальш-двери. Мило Зал большой, общий, есть сцена, туалеты чистые, теплые, светлые.Меню оригинальное. Кроме всяких там блюд из сига и муксуна есть жаркое из изюбра и еще несколько позиций из дичи.есть коктейли на баре.Дорого. 3 буузы стоят 600 р (везде около 60 за штуку), но подача красивая, вызовет аппетит, вкус тоже близок к идеальному.В общем, мы вернулись туда и ужинали второй раз. очень понравилось.
6;отличный интерьервкусные блюдаесть проблемы со скоростью обслуживания, когда за столиком более 4 людей. ощущение, что часть заказа теряется, т.к. блюда начинают оперативно приноситься после подключения администратора администраторам большое спасибо :) проблема быстро решается
6;Очень симпатичное атмосферное место! Цены немного выше среднего, но вполне нормальные. Коктейли на 4 из 5. Но живой камин скрашивает этот маленький недостаток. Поэтому с чистой душой ставлю пятёрку!
6;Ресторан отлично, гостиничный номер интерьер хорошо - слышимась хорошая слышно как сосед зивает. Расположение отличное.
6;Ужинали в июле 23г. Интерьер стильный. Порции маленькие, цены очень высокие, дороже чем в ресторанах Москвы. Больше не пойдем. Пафос и завышенный прайс, больше ничего хорошего. Карты принимают. Официанты вежливые. Народу мало, но не пусто, т.к. блюда вкусные. С улицы приходить не рекомендую, если хотите сытно поесть. Но просто посидеть в хорошем месте с видом на закат можно. Оценка 4 из-за маленьких порций и дороговизны. Не наелись, хоты потратили по 1.5тыс на человека на еду, алкоголь не брали. Такой уровень отеля и ресторана.
6;Не скажу что супер вкусно, но как придорожное кафе, вполне достойно. Бузы вкусные. Бухлер мы не поняли, но как мясной бульон  интересен. 
6;Уютное место, приятно посидеть, настоящий камин ?????? но, конечно, всё очень долго несут, это в целом проблема на острове)
6;"Ресторан вкусный, но само меню довольно скудное. Наши друзья уже останавливались несколько раз в отеле и, например, подача борща раньше была с салом. Сейчас сало только в большом сете за 1200 рублей. Из того что нам понравилось: картошка с мясом, пельмени из дикого мяса. Также отличные завтраки. В ресторане классный камин. Что бы хотелось пожелать: 1. Музыка хорошая, но уже на второй час надоедает; 2. Расширить меню (даже из тех ингредиентов что уже есть); 3. Добавить отдельные позиции сала, языка И так далее;  4. В порции драников три больших куска самих драников и очень мало рыбы. Не будьте жадными, и люди будут чаще возвращаться."
6;Замечательное заведение, единственное на всем острове, где можно душевно посидеть и вкусно поесть в очень красивой обстановке)Некоторых позиций не было, видимо сюда поставки едут долго, и чуть не расторопный персонал, а так в целом отлично ?? 
