id_cat;text
34;Отличные сдвоенные домики, внимательный персонал.
34;Отличный персонал. Складывается ощущение, что приехал в гости к своим родственникам. Вполне приемлемые номера. Ну и конечно вид на Байкал!
34;Неожиданный комфорт на необжитых берегах Байкала!!!
34;Отличное месторасположение . Своя столовая с круглогодичным режимом. Теперь и он-лайн  метеостанция ?? ! Цены завышены,имхо. И , да , нет ТВ в номерах , ?? , такая политика .
34;Жили в двухместном номере,  вода,  душ,  все работало,  кормили очень вкусно,  есть баня,  но надо заказывать и оплачивать отдельно.  Баня супер
34;Всё было классно! Рекомендую.
34;База отдыха огонь. Хорошие номера, уютные, чистые. Цены приемлемые.
34;Хорошие номера, кормят вкусно. Дорогой алкоголь
34;Прекрасное кафе??
34;База находится в очень красивом месте. Комната мне досталась маленькая, но тёплая. Персонал приветливый. Обеды и ужины лучше заказывать отдельно, а не комплексные.
34;Завтрак шведский стол. Кухня нормальная. Номера хорошие чисто уютно. Персонал приветливый и доброжелательный.
34;Комфортное жилье, отличное питание в кафе по разумной цене. Баня выше всех похвал.
34;Каждый год, два раза в год - я там. Молодцы, держат марку. Развиваются.
34;Отличное место для отдыха
34;Здорово, что можно остановиться зимой. Неплохая еда в кафешке. Но сами домики конечно уже требуют ремонта. Весьма простоваты. Только за это 4ка.
34; Место клевое! Номера хорошие. Еда вкусная. Администраторы отзывчивые. Немного хромает сервис, вернее обслуживающий персонал-официантки. Но в целом, рекомендую!
34;Отдыхали на базе с друзьями по их рекомендации. Проживание как дома,уютно и комфортно! Ребятишек не страшно отпустить одних играть ,все огорожено и безопасно! Очень довольны отдыхом на Уюге. На будущий год надеемся снова отдыхать здесь!!! Рекомендуем всем.
34;Есть где погулять, не далеко от Байкала, красиво, сервис хороший
34;Очень понравилось место. Отдыхали по соседству в Ольтреке и для разнообразия сходили в столовую Уюги. Оченю ютный внутренний двор базы отдыха, красивые ухоженные домики, хорошая детская зона. Есть небольшой басеен с шезлонгами на улице. Очень уютное кафе-столовая! В следующий раз выберем Уюгу!
34;Номер грязный, мебели в номере нет кроме кроватей, чайника нет холодильника тоже, зимой очень холодно . За всё это удовольствие 4000 руб. Впечатление от отеля очень плохое
34;Одно из мест силы на батюшке Байкале.
34;Хорошее место!
34;Красивая и впечатлительное место. 
34;Удобное расположение, приятный, доброжелательный персонал. Очень красивые виды на Байкал, на Ступу.
34;Можно отметить вкусную еду
34;Хорошее место, уютные номера, красивый берег Байкала.  Цена проживания не маленькая, но в целом соответствует
34;Для малого моря база сносная. В туалете не воняет, душ даёт нормальный напор горячей и холодной воды. Номер попался большой, всё сделано без души и внимания к деталям. Неуютно (я говорю про это, потому что за 6000р в сутки я хочу чего-то большего, чем ночлег на минималочках). Работает кафе с приемлемой едой.
34;Очень совеиую, номера чистые, удобные, есть душ и твплет, персонал вежливый, кормят вкусно, псть выбор в меню, Байкал находится рядом, красивый вид из окна номера, отдых с семьёй и детьми промто лучше турбазы нет, детская площадка, бассейн ??????
34;Радушные хозяева, развлекают, вкусно кормят (собственные белые грузди, варенье из дикой смородины, чай с байксльскими травами)
34;Самый лучший лед на Байкале именно здесь! Вполне легко добраться. Сюда едут хорошие люди.
34;Тёплый приём, есть где детям поиграть, не плохие домики но дороговато, два огромных каменнистых пляжа, от домиков до пляжа примерно 1км
34;Отличный семейный отдых. Номера оборудованы всем необходимым. Гостеприимные хозяева и великолепие природы заставят вас полюбить это место навсегда!
34;Нам рекомендовали друзья, читали хорошие отзывы. Но оказалось не очень, номера старые, запох старости и кошек. Жили в домике. Зимой тепло, 2 обогревателя за глаза.Персонал отзывчевый. Но сервиса нет. Я бы туда не поехал.
34;Хороший отель, чисто. Еда отличная, завтрак обед и ужин. Все сотрудники вежливы и приветливы. Цены средние. Горячая вода постоянно. Близость к Байкалу. Кофе зерновой. Домашние продукты дополнительно. Рекомендую!!!
34;Очень понравилось.  Домик на две семьи 7500. В домике очень тепло, 3 кровати и диванчик, стол, два стула посуда, постельное. В каждой комнате свой туалет. Общий холодильник и кухня. Очень комфоптно и уютно! Рекомендую.
34;Байкал делает это место безусловно прекрасным в любой сезон.. Красиво очень, уютно, вкусно кормят и в домиках есть всё необходимое. Домики тёплые, все просто и со вкусом.
34;Очень красивое место!  Воздух очень чистый! Рекомендую посетить! Сезон купания только в конце июля!!!??????
34;Отличная база отдыха, в красивейшем  месте малого моря озера Байкал.
34;Нам очень понравилось -что в этих трёх словах, там надо просто взять и побывать...        однозначно ещё приедем....
34;Одна из немногих турбаз, где море как на ладони. Тишина - большой плюс этой турбазы. Отличный, приветливый персонал. Чудесная кухня.
34;"Отличное место для семейного отдыха - приезжают с детьми. Есть чем заняться ребенка (батут, бассейн, детский городок, комната и игры). Рядом находится очень много мест для посещений пешком и на авто (мыс Уюга, мыс Курма и Курминские озера, мыс Хадарта, ""Орешник"", Серебряный источник...  и  т.п.). Видели даже Байкальскихтнерп. Питание превосходное. Много солнечных дней. Рекомендую для посещения в любое время года.  Очень отзывчивый персонал."
34;Супер! Спасибо за прекрасный отдых. Великолепные виды!
34;"Прекрасный очень дружелюбный, тёплый отель с великолепным соотношением ""цена-качество""!Настоятельнл рекомендую!Огромная просьба: мой временной слот НЕ ЗАНИМАТЬ!!! ??"
34;Одна из лучших баз на Малом Море! Все номера с удобствами, большая часть с мини-кухней, чайником и холодильником, все для людей :). Хорошее кафе, которое работает с утра до вечера ( кальмары в кляре и рыба - просто отличные), а главное, конечно, готеприимство и профессионализм хозяев базы :). Ездим сюда уже больше 10 лет!
34;Место затмевает все!
34;Огонь ??, но цены пипец 
34;Домики уютные,  благоустроенные. Природа красивая, до Байкала от базы около 700 метров. ОЧЕНЬ дорогое кафе, цены не соответствуют качеству. Кухня в бунгало-студии мало пригодна для приготовления пищи, малюсенький холодильник, нет необходимого набора посуды.
34;Были в январе 2020 года.  Хороший уровень сервиса, приветливый персонал, домашняя обстановка.  Кухня хорошая, было вкусно.  Место просто шикарное, стоит ехать на сразу на 2-3 дня.
34;Очень понравилось!
34;Нравиться база. Правда только зимой приходилось бывать там. В особенности нравятся отдельные благоустроенные домики на несколько человек. Уютно, своя кухня. Замечательный вид на Байкал.
34;Удобная база в красивом месте. Можно с детьми, с собаками. В кафе очень вкусная выпечка, особенно разные пироги.
34;очень душевное место))
34;Отдыхали в номере за 6500, за эту стоимость не входит ни завтрак, ни уборка в номере. Неуютный номер, в кафе отвратительная еда. Кофе будит не содержанием кофеина, а печальностью вкуса и отсутствием выбора.
34;Вкусно готовят. Не дорого. Отдыхали в начале марта, работал обогреватель, т.к. центрального отопления нет. Из-за этого, воздух очень сильно пересушен.
34;Одна из лучших турбаз на Малом море. Находится возле мыса Уюга, за Сарминским ущельем.  Очень красивая природа, зимой сюда приезжают кататься на коньках по прозрачному льду байкала и смотреть на сказочные ледяные природные скульптуры.
34;Все супер, кафе хорошее, вежливый персонал.
34;Природа неотразимая!!!!. Байкал это самое прекрасное что есть в России!!!!!
34;Клёвое место для ценителей природы
34;В начале марта, в будни, здесь довольно-таки прохладно, просторно, но в кафе многолюдно ( корпоратив??) Уютно.
34;Наши сердца остались здесь!  Приезжаем сюда уже 11 лет и не по одному разу в год... Ни разу не было сомнения где встретить Новый год или провести незабываемую неделю летом. Всегда приветливые хозяева, вежливый персонал, удивительная природа и масса положительных эмоций!!!  
34;Потрясающее место! Гостеприимный коллектив! Еда на высшем уровне! Советую всем, всем, всем!!! Уровень высокий
34;Самое замечательное место, где можно отдохнуть????
34;Место очень красивое!Хороший персонал!
34;Отличная гостиница, учитывая особенности тех мест. Практически достойный Отель. Особенно если брать номер в домике
34;Отличное место, хороший персонал. Вернёмся ещё раз
34;Класный комплекс отель.
34;Красивая, уютная, но частенько шумно, много народа.
34;Очень понравилась интересно оформленая территория. Номера уютные. Очень приветливый персонал. Обязательно приедем ещё.
34;Дорога просто ужас, а так очень хорошее место.
34;"В далеке от ""цивилизации""...в тихом безлюдном месте находится база Уюга. Удивили комфортные ....теплые..уютные номера, прекрасная кухня на любой вкус и потрясающий вид Байкала.Для тех, кто хочет отдохнуть  от городского шума не расставаясь с комфортом, Уюга_ прекрасный выбор.Благодарю всех сотрудников базы за созданные условия.Елена."
34;Приятное место на Байкале для отдыха! Чудесное кофе подают в Кафе! 
34;Крутая гостишка. Но дороговато. Но она расположена в очень крутом месте! Мангал правда убогий у них. Мясо еле пожарили.
34;Супер база! Отдыхали в 2020 г. в августе. Такие места красивые, не передать словами!
34;Обычная для Байкала турбаза, удобства на улице, развлечений особых нет, кухня нормальная, без изысков.
34;Нам очень там понравилось.
34;Изумительнейшая база.Всё сделано с огромной любовью ! Ощущаешь заботу во время всего пребывания.  Огромная благодарность хозяевам и всем сотрудникам за  отдых!
34;Рядом Байкал, а ты живешь в домике как в городской квартире, ну как тут не дооценить... Сервис конечно не европейский, персонал не всегда может определиться из какого он века, но в основном люди доброжелательные и помогают, когда это необходимо по службе и без такой необходимости. Место очень красивое.
34;Не ждите пяти звёзд на Байкале. Он не для этого. А вот в Уюге все необходимое и на любой кошелек вы найдете.
34;В гостинице небыл, обедал в кафе, обстановка приятная, а кухня отстой!
34;Огонь??
34;Хорошая турбаза с опрятными номерами. Просторная столовая. Вкусная еда и умеренные цены.
34;Все хорошо, до Байкала далековато, бассейн на улице был пустой.
34;Отдыхали там раза четыре. Брали собаку(разрешается). Делаются экскурсии, как пешие, так и водные. Пляжи галечные. Воздух можно чуть-ли не пить. Ну и конечно сам Байкал ??????
34;Всё отлично, персонал вежливый, отдых замечательный, приеду с семьёй сюда обязательно. Всего наилучшего!
34;Красота, но дорога полный..... 
34;Одно из любимых мест на западном побережье Байкала
34;Хорошая база. Уютные домики. Кормят вкусно.
34;Приличные номера, доброжелательный персонал, кафе, где меню по выбору и в любое время и вид на сам Байкал...
34;Дороговато, в номерах очень очень все дешевское. в кафе персонал не квалифицированный. апельсин 150р. шт.  и в данном месте рыбы нет (
34;Нормас. Не дорого. Вид хороший.
34;Отличное место, кафе вне конкуренции
34;Классно отдыхать. Очень понравилось
34;Уютные благоустроенные номера, большая территория, шикарный вид на озеро Байкал, пляж в десяти минутах ходьбы.
34;Красивые и живописные места со своей аурой. Аршан Кучигер и Умхэ стоит посетить.
34;Теплая, дружелюбная атмосфера
34;Супер красивое место.Обслуживание на уровне.Позы - огонь)
34;Неплохая гостиница, но до Байкала где-то километр
34;Баня отличная .В домике плохо убираются .В Кафе очень маленький выбор блюд.
34;Природа, Байкал и сама турбаза оставляют самые лучшие впечатления. 
34;Очень приятное место и заботливый персонал. До Байкала 5 минут пешком, там же красивейший Мыс Уюга.
34;Приемлимое кафе для этой территории. Заказывали позы, солянку. На твердую четверку. Персонал молодцы стараются.
34;Номера не удобные, узкие, но тёплые. В номерах туалет, душ. 
34;Обязательно открывать вентили батарей перед сном, иначе очень душно.Отличное место для отдыха с семьей и детьми
34;Отличная база для отдыха с семьей
34;Великолепное место для отдыха.
34;Уютно, чисто за адекватную цену. Всем рекомендую ????????
34;мне очень понравился домик, сами хозяева, кухня и цены в кафе. были в мае, когда еще природа не ожила, а на лед не выйти, вроде и делать нечего, но ничего подобного! довольно активно провели время и впечатления - АХ!  велосипеды в прокат, бильярд, аэрохокей - все есть.
34;Был зимой. Нормальное питание. Есть wifi. В 500 метрах от Байкала.
34;Номера, шведский стол просто супер ??
34;Можно хорошо отдохнуть
34;Хорошие номера, все свежее - ремонт и мебель. Дома расположены так чтобы не мешали соседи. А вот в ресторане было похуже - еда на 3 и не очень приветливая девушка на приеме заказов.
34;Хорошая гостиница, вежливый персонал. Рекомендую
34;Очень уютно!!!
34;Уютная база отдыха, есть басеин и детская площадка. Хорошая столовая.
34;Всё очень понравилось
34;Отличное место для семейного отдыха и рыбалки
34;Хорошая турбаза, удобные номера.Неплохая кухня. Соответствует цена качеству. 
34;Хорошая гостиница
34;"Не понравилась кафе. Зашли  с семьей перекусить, очень долго обслуживали, едп на ""3"""
34;Ужасное кафе! Обслуживание плохое, блюда невкусные, цены большие.
34;Хорошие и теплые домики. Недалеко от Байкала и Огоя.
34;Хорошая база
34;Красиво. Хорошо готовят повара.
34;Отличное место для отдыха. И самый большой каток в мире. И самый ровный лед.
34;Просто супер! Мы там  обедали, ужинали. Особенно вкусный творожный пирог
34;Лучшая турбаза на байкале. Всем рекомендую
34;Здесь зашибись,... а в Ольтреке лучше )))
34;Хорошая база, живописное место...
34;Удобное расположение, персонал отличный.
34;Отдыхали в Уюге несколько раз. Очень понравилось.
34;Приезжаю каждый год, всегда как дома, хозяева радушные всегда, молодцы, все для клиентов
34;Хорошее место, работает зимой и летом, неплохая столовая и комнаты.
34;Хорошее место для отдыха.
34;Отличное место
34;Класс! Отдыхали всей семьей после тулунского потопа! Еще поедем.
34;Как дома
34;Вкусно, чисто, всё остальное тоже рядом!
34;Отличный комплекс, советую
34;Прекрасный персонал уют комфорт
34;Всё классно, всё понравились. Только водка дорогая.
34;Отличное место для отдыха: были зимой. Если выбирать базу отдыха в том районе: только к ним.
34;Отличное место. Красота.
34;За те деньги, которые просят, просто полный отстой.
34;Приятный персонал, хорошие домики. Всё понравилось, поедем еще.
34;Великолепное место
34;Всё класс класс класс. Хочу ещё туда.
34;Отличное место!!!!
34;Были зимой, все понравилось!!!
34;Тепло, уютно,  сытно.
34;Хорошо и дорого)
34;Отличное место !
34;В полне хорошо там
34;Отличная база!
