id_cat;text
30;Разнообразное бурятское меню. Нам еда понравилась. В кафе чисто, приготовили блюда достаточно быстро
30;Долгая подача, грязные приборы. Немешало бы провести уборку, так как видно, что давно не убирались, не мыли. Всё в пыли. Еда на 3 с минусом.
30;Заходили не раз в надежде поесть, но там либо вообще заказы не принимают либо нет почти всех позиций. Как-то печально во время аншлага. Зато через дорогу в 35 доме есть отличное кафе с домашней едой. Долгое ожидание, но оно того стоит
30;"В целом неплохо, ожидание по времени среднее.  Вкусные драники, подают на доске, красиво) Пельмени вот только можно было хоть маслом чуть-чуть сдобрить и укропчиком присыпать, а подали просто ""ни с чем""."
30;Уютно. Время ожидания среднее. Не всё меню есть в наличии. Персонал приветливый.
30;Сменилось руководство. Отличное кафе. Очень вкусно кормят. Приятный и вежливый персонал. Демократичные цены. Рекомендую к посещению!
30;Приятная обстановка. Приветливые работники. Советую буузы и хужур, шашлык.
30;Замечательное кафе. Очень вкусно. Приветливый персонал.
30;Отзывчивый персонал. Расположение практически в центре города.цена умеренная, народу очень много. На отрезок времени, когда я там была.
30;Отличные буузы, но больше половины меню не было два дня подряд. Чебуреки тоже вкусные) возвращались)
30;Еда на Ольхоне есть гораздо вкуснее. Ожидание говорят одно. В итоге Гораздо дольше! Официант совсем неприветливый. 
30;Вкусно! Свежий сагудай! Быстрое и приятное обслуживание. 
30;Все хорошо. При большом наплыве посетителей возникает ожидание. Путаница с заказами
30;Были на этом острове в январе. Народу очень мало одно нормальное кафе на весь посёлок но магазинчиков работает много. Байкал очень красивый зимой! И классные лёд и байкальские просторы!
30;Заплатил и жди заказ минут 40,девушка учтиво говорит,при этом кафе абсолютно пустое,если вы очень голодный то не рекомендую(
30;Приятное место! Заказ подали очень быстро. Заходили компанией из шести человек, все остались довольны!
30;Буузы неожиданно очень вкусные, в Иркутске такого вкусового качества нет! Чебуреки на четверку - маловато мяса. Поставил 3 звёзды - во втором зале запах из туалета из-за чего смазано всё положительное впечатление.Позы в данном рекомендую!!!
30;Даже нечего сказать. Мне кажется сервис даже в табачных магазинах лучше. Только за позы 1 звезда. 
30;Так себе, коль уж в туристическом месте кафе, можно было бы и обслуживание чуть подружелюбнее. Меню обычное. Брала блюда которые невозможно испортить, вроде норм по вкусу. Столы да, действительно липкие , неприятное ощущение Неоднозначное ощущение после посещения данного места. 
30;Заказывали омуль жареный. Небольшой, вкусный. Позы отличные
30;Не понравилось, кофе подали прозрачный почти, из спиртного есть самогон, НО в нем от силы 30 градусов
30;Логман – огромная порция. Съели на двоих. Позы и хушур вкусные. В салат загудай просился лимончик. Но это на мой вкус. Не настаиваю))) Пиво только разливное Хайникен, но оно было холодное, за что отдельное спасибо. 
30;Отвратительное место. Больше похоже на столовку низкой пробы. Столы грязные липкие. Размещение столов не удобное. Заказ пришлось ждать 50минут. Лагман на вкус ужасен. Вместо кусков мясо кидают куски жира. Заказали фри с курицей. Принесли несоленную картошку и 2 крыла курицы которую приготовили ещё вчера, а сегодня в микроволновке разогрели.  Салфеток нет ни на столах ни за баром. Цены не соответствуют качеству. Позорят местную кухню. В меню местные блюда отсутствуют) судя по отзывам их там никогда не было
30;Отвратительное обслуживание. Сидели 40 минут, в итоге просто забыли о нашем заказе. Подходили на стойку три раза, нам сказали что заказ готовится. По факту забыли про заказ и сделали половину только заказа спустя 40 минут. Работают студенты, которые совершенно рассеянные и пофигистичные. Отстой, короче. 
30;"Были на Ольхоне во второй половине января 2021. В ""не сезон"", конечно, выбор кафе, магазинов и пр. действительно ОЧЕНЬ не велик. Да и отношение к туристам в межсезонье не высший класс) Однако данное заведение теперь возглавляет список с самыми негативными воспоминаниями! Дело даже не в том, что девушка за стойкой на наше ""Здравствуйте"" буквально бросила в ответ ""Здрассе"". Глядя на меню, написанное ручкой на листочке в клеточку мы решили задать резонный вопрос - всё ли есть из ""меню"". На что эта мадам театрально выпучив глаза буквально рявкнула ""НЕТ!"". Честно говоря, думал такое бывает только в юмористических передачах. Поставил бы 5 баллов, если бы туда не заходил."
30;Позы не вкусные, не сочные, очень жирные. Чебурек очень сильно насыщен маслом, мясо безвкусное. Цена и вкус еды не соответствует. Не рекомендую к посещению.
30;Одно из лучших кафе на Ольхоне. В меню представлены блюда бурятской и европейской, а также русской кухни. С овощами у них, конечно, проблемы, но на Ольхоне эти проблемы я наблюдала повсеместно. Относительно дружелюбный персонал, относительно быстрая подача блюд.
30;Еда посредственная, чай умудрились принести просто холодный, он даже не заварился, из меню стопа было много... В кафе холодно...
30;Как приятно видеть что цивилизация не только в Москве но и за 6 тысяч км
30;Были летом, на утро встали с острым отравлением.  Очень дорого, столы не моют, явная антисанитария на кухне, по помещению тусуются бездомные собаки. На острове есть нормальные рестораны с комфортом и сертификатами.
30;Зашли в кафе, сотрудников две минуты не было. Пришли с улицы, маски кто-то не надевает, официанты носят сланцы. Грязный туалет, грязные столы, нет салфеток на столе. Вода в туалете еле течёт. На кассовом аппарате время выставлено неправильно, так что я не понял, сколько времени прошло с момента заказа, но все салаты выносят через 15-20 минут после заказа, а горячие блюда ещё дольше. О том, что борща нет, сообщили через 15 минут после заказа, заменённый суп принесли ещё через 10 минут. Полный бардак, заказы все напутали, выносят и говорят неправильный номер. Но позы очень вкусные.
30;Еда здесь просто класс. Одна из лучших кофейн на Ольхоне. Если будете тут, то обязательно попробуйте бууры (они же позы). Были тут с друзьями зимой, очень все понравилось. Также, когда к вам подойдут с предложениями об экскурсиях, то тоже не отказывайтесь, не пожалеете)
30;Пельмени меньше пробки из под пива 
30;Пришли в заведение, никто не подходил минут 10, заказ не принимали. После решили заказать сами за стойкой, простояли ещё минут 10, девушка официант бегала мимо нас, так и не приняла заказ! Нас конечно предупредили что сервис немного хромает, но тут гостям не рады и не заинтересованы в них. Смело ставлю единицу и никому не рекомендую!
30;"Хуже заведения это надо ещё поискать! Еда отвратительная, обслуживание с видом ""чего вы припёрлись""! Посуда грязная! Стаканы заляпанны до непрозрачности! В общем, не ходите, не портите впечатление от одыха!!!"
30;Отвратительное заведение. Антисанитария полная и в зале и на кухне. Подавали еду в грязной посуде. Заказали борщ, буузы и чай таёжный. В борще было старое мясо говядины, которое не жевалось. Буузы воняли кислятиной и было видно, что их замораживали и размораживали перед этим много раз. Чай был мутный и пах отвратительно. Чайник для чая был грязный и с подтеками от жира. Очень недовольны обслуживанием. Не рекомендуем к посещению. Особенно в не сезон!!!! 
30;В целом не плохо, правда не все блюда из меню были. Выбирали из того  есть.  Было вкусно.Обслуживание на 5
30;Были в октябре на острове Ольхон и решили по рекомендации посетить данное заведение. Клиентам там не очень рады, половина меню отсутствует, мальчик за кассой не может описать никакое блюдо, а то что может там уже мы не можем понять, с русским языком небольшие проблемы у него, то что принесли так и не смогли съесть. На все остальное уже не обращали внимания. 
30;Посторное кафе, обслуживание не быстрое, но еда свежая и вкусная. Солянка очень вкусная. Позы, на мой взгляд, пресноваты. Не хватает специй, но тут уж на вкус и цвет. Кафе рекомендую, если хотите вкусно поесть, но не спешите. Подача блюд где-то 20 минут. Цены хорошие, порции большие.Минус за очень грязный туалет. 
30;Вкусно и уютно, спасибо за быстрое обслуживание)
30;Были под закрытие сезона, людей почти не было. За кассой для заказа пришлось стоять минут 5 пока кто либо подойдёт. Суп с домашней лапшой неплохой., чебурек сухой и безвкусный. Цены чуть выше чем в соседних местах. Из кухни ходят маленькие дети (видимо дети работников-бурят) и постоянно что то просят. Ожидание достаточно долгое., столы плохо убираются. Позы хуже магазинных. Настоятельно не рекомендую это место ! 
30;Домашняя еда, но очень долго получается готовка. 
30;Самая лучшая уха впервые за 30 Лет по пробывал настоящую уху)
30;Не очень, в чебуреках мало мяса, всего одно меню на всех, лучше идти в Далай. 
30;Заходил 14.06.2023, но поесть не удалось, т.к. половина меню была в стопе
30;Очень долгое обслуживание, при занятости зала на 50% и нескольких официантах ждала заказ более получаса и принесли уже давно готовое и уже заветренное блюдо. Даже в микроволновке греть с первого раза не хотели... Самое ужасное кафе на Ольхоне.
30;Кофе есть, а кофемашины нет )) Как это, не подскажите? )))
30;Приезжала в марте,было не пробиться и выбора не было,так и не посетила..сегодня же все свободно и отличные драники сделали мой день ????????
30;Были в этом кафе раньше - не очень впечатлились - было грязновато, да и долго приходилось ждать заказ. Но в недавнее посещение очень понравилось! Блюда вкусные, овощи свежие, хорошие десерты! Минут 20-30 придётся, наверное, подождать при большой загруженности, но качество еды отличное!
30;"Еда горячая и вполне вкусно. Ща это -4, а ьак- персонал пропадает, терминал на оплату ""не работает"", то ли самообслуживание, то ли все же официанты есть.. не определились. Порядок юлюд- как придётся."
30;Качество обслуживания желает быть лучше
30;Антисанитария.  Грязная посуда.  Отравились все кто ел из группы.  Не советую никому! Обязательно напишем жалобу, чтобы такого места тут не было.
30;Вкусно, но как везде по Байкалу дорого
30;Это лучшее место в Хужире. Тут не хамят. Тут можно заказать всё что есть в меню. Тут вкусно. Единственное, надо бранировать столы, так как место популярное. Поэтому, если хотите сберечь время, звоните заранее насчёт стола и приходите вкусно кушать. 
30;Довольно вкусные позы ,хорошее мясо
30;Ребята старайтесь лучше и будьте внимательны. По всем трём блюдам вышел промах.Удачи!
30;Были в кафе 10.02.2021, первый минус когда принимали заказ, второй когда они не смогли устроить место на 9 человек и мы сами устроились, далее началось самое интересное, принесли рюмки стаканы все жирные в пятнах,  столовые приборы просто бросили на стол без салфетки и посуды в количестве меньше присутствующих.  Про несколько заказов вообще забыли. Когда мне принесли говядину и пюре я был без вилки и попросил принести, через 5 минут в салфетки принесли и убежали и когда я развернул там оказался только нож, и далее было ещё очень много косяков....
30;Хорошее место , очень вкусно, везде чисто
30;Юноша-офицтант принес заказ ну очень грязными руками, позы были средние, при этом много лука и кусочек полиэтилена внутри 
30;Очень вкусно и ярко, учитывая местный колорит. Не ждите ресторанного обслуживания, вы в кафе! Рекомендую!
30;Пожалуй, одно из лучших кафешек на острове, хотя все очень скромно, но все кафешки, в том числе, именуемые себя ресторанами, далеки от формата хорошего кафе, увы, но очень далеки...
30;Хорошее кафе в самом центре, относительно быстро готовят, но не всегда есть всё из меню.. хотя на ольхоне это повсеместная проблема.
30;Все достойно, но дорого.
30;Бухлер, бузы, чебуреки - бесподобны!!!
30;Очень долго ждать заказ, 3 бузы ждали час!!! И это не при полной посадке. Клиентоориентированность на нуле, когда стоишь за баром и ждёшь хоть кого-то, тебе хамят и отвечают, что еще 3 года подождёте мол. Официанты злые, вообще с тобой не разговаривают, все время забывают и путают у кого какие заказы. Принесли еду сначала людям, которые были после нас. Кухня не то чтобы вкусная, самая обычная столовка. Не рекомендую, не тратьте своё время!!!
30;непонятно за что 4 заезды. Оплату просят вперёд) Подали свежеподогретый (несколько кусков не успели прогреться) шашлык из свинины, причём перед этим друг уточнил готовят ли они его на огне. Внутри находиться не хочется - грязновато. Пива в бутылках нет.Из плюсов: пустили с собакой, но вероятно им было просто все равно)
30;Впечатлений масса, это надо видеть, словами не передать.   
30;Ожидание крайне долгое, сидим уже 40 минут, позы до сих по не принесли, при этом клиентов почти нет. Update. Ожидание поз 55 минут. Столы липкие и грязные, на полу грязь. После клиентов столы не протирают, просто убирают посуду. Не рекомендую. Загудай средний. 
30;Я счастлива, что здесь побывала
30;Не очень чисто, в еде попадаются волосы, сама еда не всегда свежая. Была в начале июня - не все что в меню есть в наличии.
30;И мы там были, не мёд и пиво, но чай пили)
30;Очень круто!!! Особенно зимой
30;Не самый лучший вариант) 
30;Хорошое кафе, вкусно готовят, приветливо встречают, уходить не хочется
30;Природа замечательная!
30;Очень долго ждали еду, больше часа. В итоге приготовленная курица была с перьями. Официанты агрессивные. Не советую это заведение.
30;Столы грязные, салфеток нет. Заказ ждал более часа, обслуживание отвратительное. Не рекомендую к посещению, очень портит настроение. 
30;Цуйван очень хорош, всё остальное тоже неплохо
30;Это просто жесть!!!Грязная посуда и грязный стол на который кладут приборы. Не могут посчитать количество людей и приборов.  еду не могут вовремя принести, приносят мороженную, или холодную или с волосами!! Я вас прошу не ходите сюда. Тут много других кафе!! Даже и 1 звезды не достойны!! 
30;"Готовят в этом кафе, действительно, вкусно. Но, видимо по этой же причине, в кафе Ольхон, постоянно большое количество посетителей и ждать свой заказ приходилось (как в Московских ресторанах) более получаса, минут сорок... Отличные позы и мне понравился салат ""Вулкан"". Да, а так же отменная уха с рыбой и икрой. Первый раз такую тут попробовала.  Маленький минус - один туалет и очередь в него))"
30;Лучшее место где я бывал!!!
30;Будьте готовы ждать, даже не так ЖДАААТЬ. мы сидели единственные в кафе и ждали больше часа. Блюда на вкус вполне посредственны.А, да! В наличии не было половины меню при заказе, так плюс к этому об отсутствии части позиции оповестили через полчаса после непосредственно заказа. 
30;Норм кафе. Быстро и съедобно
